{
  "schema_version": 1,
  "kind": "provider_capability_descriptor",
  "provider": "openai",
  "runtime": "responses_api",
  "usage_mode": "api",
  "adapter": "BoundedResponsesAuditProvider",
  "capabilities": [
    {
      "name": "CODE_REVIEW",
      "status": "SUPPORTED",
      "result_contract": "audit_result_v1"
    }
  ],
  "authority": "EVIDENCE_ONLY"
}
